{
  "name": "Prometheus 联邦集群演示",
  "language": "monitoring",
  "difficulty": "expert",
  "description": "使用 Docker Compose 模拟多个 Prometheus 实例，通过联邦抓取（federation）将聚合指标汇聚到全局 Prometheus，实现多集群统一监控。",
  "keywords": [
    "prometheus",
    "federation",
    "cluster",
    "monitoring",
    "multi-cluster"
  ],
  "author": "OpenDemo Team",
  "version": "1.0.0",
  "created_at": "2026-06-27",
  "updated_at": "2026-06-27T01:30:00",
  "verified": true,
  "verified_at": "2026-06-27T01:30:00",
  "estimated_time": "60-90分钟",
  "prerequisites": [
    "Docker",
    "Docker Compose",
    "基础监控概念"
  ],
  "files": [
    "README.md",
    "metadata.json",
    "docker-compose.yml",
    "configs/prometheus-global.yml",
    "configs/prometheus-dc1.yml",
    "configs/prometheus-dc2.yml",
    "scripts/start.sh",
    "scripts/stop.sh",
    "scripts/check.sh"
  ],
  "dependencies": {
    "software": [
      "Docker",
      "Docker Compose"
    ]
  },
  "compatibility": {
    "operating_systems": [
      "linux",
      "macos",
      "windows(wsl)"
    ]
  }
}
