{
  "name": "Go函数编程实践Demo",
  "language": "go",
  "keywords": [
    "函数",
    "高阶函数",
    "闭包"
  ],
  "description": "通过实际示例学习Go语言中函数的多种用法，包括基本函数、高阶函数和闭包。",
  "difficulty": "beginner",
  "author": "OpenDemo Team",
  "created_at": "2025-12-11T23:01:10.349030",
  "updated_at": "2025-12-11T23:01:10.349030",
  "version": "1.0.0",
  "dependencies": {},
  "verified": false,
  "verified_at": "2026-06-27T00:05:00",
  "estimated_time": "60-90分钟",
  "prerequisites": [
    "相关基础知识"
  ],
  "files": [
    "README.md",
    "metadata.json"
  ],
  "compatibility": {
    "operating_systems": [
      "linux",
      "macos",
      "windows(wsl)"
    ]
  }
}
