{
  "name": "Bytedance",
  "language": "kubernetes",
  "difficulty": "intermediate",
  "description": "Bytedance 的 Kubernetes 实战演示与配置详解",
  "keywords": [
    "kubernetes",
    "k8s",
    "bytedance"
  ],
  "author": "OpenDemo Team",
  "version": "1.1.0",
  "created_at": "2025-12-11T17:08:29",
  "updated_at": "2026-06-27T00:00:00",
  "verified": true,
  "verified_at": "2026-06-27T00:00:00",
  "estimated_time": "60-90分钟",
  "prerequisites": [
    "Kubernetes 基础知识",
    "kubectl 已安装"
  ],
  "files": [
    "README.md",
    "metadata.json"
  ],
  "dependencies": {},
  "compatibility": {
    "operating_systems": [
      "linux",
      "macos",
      "windows(wsl)"
    ]
  }
}
