{
  "name": "template-strings-demo",
  "language": "nodejs",
  "keywords": [
    "模板字符串",
    "ES6",
    "字符串操作"
  ],
  "description": "展示Node.js中模板字符串的多种实用场景",
  "difficulty": "beginner",
  "author": "OpenDemo Team",
  "created_at": "2025-12-11T13:58:19.743896",
  "updated_at": "2025-12-11T13:58:19.743896",
  "version": "1.0.0",
  "dependencies": {},
  "verified": false,
  "verified_at": "2026-06-27T00:05:00",
  "estimated_time": "60-90分钟",
  "prerequisites": [
    "相关基础知识"
  ],
  "files": [
    "README.md",
    "metadata.json"
  ],
  "compatibility": {
    "operating_systems": [
      "linux",
      "macos",
      "windows(wsl)"
    ]
  }
}
