{
  "name": "Go-Protobuf-Serialization-Demo",
  "language": "go",
  "keywords": [
    "protobuf",
    "序列化",
    "二进制协议",
    "gRPC",
    "高效编码"
  ],
  "description": "一个展示如何在Go中使用Protocol Buffers进行高效二进制序列化的可执行示例。",
  "difficulty": "intermediate",
  "author": "OpenDemo Team",
  "created_at": "2025-12-11T17:46:04.328426",
  "updated_at": "2025-12-11T17:46:04.328426",
  "version": "1.0.0",
  "dependencies": {},
  "verified": false,
  "verified_at": "2026-06-27T00:05:00",
  "estimated_time": "60-90分钟",
  "prerequisites": [
    "相关基础知识"
  ],
  "files": [
    "README.md",
    "metadata.json"
  ],
  "compatibility": {
    "operating_systems": [
      "linux",
      "macos",
      "windows(wsl)"
    ]
  }
}
