{
  "name": "备份钩子操作演示",
  "language": "kubernetes",
  "keywords": [
    "velero",
    "hooks",
    "pre-backup",
    "post-backup",
    "database-consistency"
  ],
  "description": "演示如何使用备份钩子在备份前后执行自定义操作",
  "difficulty": "advanced",
  "author": "OpenDemo Team",
  "created_at": "2026-01-11T23:45:00.000000",
  "updated_at": "2026-06-27T00:00:00",
  "version": "1.0.0",
  "dependencies": {
    "kubernetes": ">=1.20",
    "velero": ">=1.12"
  },
  "verified": true,
  "verified_at": "2026-06-27T00:00:00",
  "estimated_time": "60-90分钟",
  "prerequisites": [
    "Kubernetes 基础知识",
    "kubectl 已安装"
  ],
  "files": [
    "README.md",
    "metadata.json"
  ],
  "compatibility": {
    "operating_systems": [
      "linux",
      "macos",
      "windows(wsl)"
    ]
  }
}
