{
  "dependencies": {},
  "name": "Kubeflow Dashboard Installation Demo",
  "language": "kubernetes",
  "description": "Kubeflow Dashboard Installation Demo 的实战演示与配置详解",
  "keywords": [
    "kubernetes",
    "kubeflow"
  ],
  "author": "OpenDemo Team",
  "version": "1.1.0",
  "created_at": "2025-12-11T17:08:29",
  "updated_at": "2026-06-27T00:05:00",
  "verified": true,
  "verified_at": "2026-06-27T00:05:00",
  "estimated_time": "60-90分钟",
  "prerequisites": [
    "相关基础知识"
  ],
  "files": [
    "README.md",
    "metadata.json"
  ],
  "compatibility": {
    "operating_systems": [
      "linux",
      "macos",
      "windows(wsl)"
    ]
  },
  "difficulty": "intermediate"
}
