{
  "name": "CRD自定义资源定义演示",
  "language": "kubernetes",
  "keywords": [
    "crd",
    "custom-resource",
    "api-extension",
    "kubectl",
    "kubernetes"
  ],
  "description": "展示如何定义和使用CustomResourceDefinition扩展Kubernetes API，创建自定义资源类型",
  "difficulty": "beginner",
  "author": "",
  "created_at": "2026-01-06T15:39:00.000000",
  "updated_at": "2026-01-06T15:39:00.000000",
  "version": "1.0.0",
  "dependencies": {
    "kubernetes": ">=1.24.0"
  },
  "verified": false
}
