{
  "name": "spring-aop-demo",
  "language": "java",
  "keywords": [
    "spring",
    "aop",
    "aspect",
    "proxy",
    "advice"
  ],
  "description": "Spring AOP面向切面编程演示，展示5种Advice类型",
  "difficulty": "intermediate",
  "created_at": "2026-04-11",
  "dependencies": {
    "java_version": "11+",
    "spring-context": "5.3.21",
    "aspectj": "1.9.9.1"
  },
  "author": "OpenDemo Team",
  "version": "1.1.0",
  "updated_at": "2026-06-27T00:05:00",
  "verified": true,
  "verified_at": "2026-06-27T00:05:00",
  "estimated_time": "60-90分钟",
  "prerequisites": [
    "相关基础知识"
  ],
  "files": [
    "README.md",
    "metadata.json"
  ],
  "compatibility": {
    "operating_systems": [
      "linux",
      "macos",
      "windows(wsl)"
    ]
  }
}
