{
  "name": "string-operations",
  "language": "python",
  "keywords": [
    "字符串操作",
    "Python基础",
    "文本处理"
  ],
  "description": "演示Python中常用字符串操作的实用示例",
  "difficulty": "beginner",
  "author": "OpenDemo Team",
  "created_at": "2025-12-13T02:14:45.162298",
  "updated_at": "2025-12-13T02:14:45.162298",
  "version": "1.0.0",
  "dependencies": {},
  "verified": false,
  "verified_at": "2026-06-27T00:05:00",
  "estimated_time": "60-90分钟",
  "prerequisites": [
    "相关基础知识"
  ],
  "files": [
    "README.md",
    "metadata.json"
  ],
  "compatibility": {
    "operating_systems": [
      "linux",
      "macos",
      "windows(wsl)"
    ]
  }
}
